{
  "distance_mpc": 18.0,
  "name": "NGC4100",
  "notes": "SPARC Rotmod ingest from NGC4100_rotmod.dat",
  "r_kpc": [
    2.61,
    3.5,
    4.37,
    5.24,
    6.11,
    6.98,
    7.85,
    8.72,
    9.6,
    10.47,
    11.35,
    12.19,
    13.12,
    13.94,
    14.86,
    15.68,
    16.61,
    17.42,
    18.35,
    19.16,
    20.09,
    21.02,
    21.95,
    22.76
  ],
  "sigma_v_kms": [
    10.5,
    7.5,
    6.2,
    6.1,
    5.2,
    5.7,
    6.1,
    4.8,
    3.9,
    3.5,
    4.4,
    4.8,
    5.3,
    4.5,
    6.6,
    6.2,
    6.6,
    8.7,
    6.2,
    5.9,
    6.3,
    7.6,
    8.9,
    9.0
  ],
  "v_baryon_disk_kms": [
    126.18,
    135.14,
    152.52,
    177.98,
    196.88,
    207.03,
    198.89,
    191.25,
    180.26,
    169.65,
    162.03,
    157.28,
    152.13,
    146.63,
    141.01,
    136.34,
    131.69,
    128.17,
    124.63,
    121.38,
    117.8,
    114.69,
    111.9,
    109.45
  ],
  "v_baryon_gas_kms": [
    5.71,
    9.28,
    13.15,
    16.38,
    19.18,
    21.66,
    23.38,
    24.46,
    25.0,
    25.65,
    26.73,
    28.34,
    30.6,
    32.54,
    34.38,
    36.42,
    38.36,
    38.9,
    37.93,
    36.96,
    36.1,
    34.92,
    33.73,
    32.65
  ],
  "v_obs_kms": [
    120.0,
    148.0,
    168.0,
    182.0,
    190.0,
    194.0,
    195.0,
    193.0,
    192.0,
    192.0,
    191.0,
    189.0,
    185.0,
    182.0,
    179.0,
    176.0,
    174.0,
    178.0,
    177.0,
    169.0,
    158.0,
    158.0,
    158.0,
    159.0
  ]
}
