{
  "distance_mpc": 8.43,
  "name": "UGC07399",
  "notes": "SPARC Rotmod ingest from UGC07399_rotmod.dat",
  "r_kpc": [
    0.61,
    1.22,
    1.84,
    2.45,
    3.07,
    3.68,
    4.3,
    4.91,
    5.52,
    6.13
  ],
  "sigma_v_kms": [
    2.77,
    3.27,
    2.5,
    2.45,
    2.48,
    3.01,
    3.62,
    3.9,
    4.82,
    4.97
  ],
  "v_baryon_disk_kms": [
    31.89,
    39.0,
    37.15,
    36.43,
    35.9,
    34.58,
    33.94,
    32.94,
    31.6,
    31.05
  ],
  "v_baryon_gas_kms": [
    2.98,
    8.37,
    14.43,
    17.93,
    20.44,
    21.54,
    21.34,
    23.04,
    25.45,
    25.55
  ],
  "v_obs_kms": [
    47.3,
    70.4,
    83.7,
    89.1,
    91.7,
    95.1,
    96.9,
    100.0,
    103.0,
    106.0
  ]
}
