{
  "distance_mpc": 7.5,
  "name": "DDO161",
  "notes": "SPARC Rotmod ingest from DDO161_rotmod.dat",
  "r_kpc": [
    0.6,
    0.73,
    0.85,
    0.98,
    1.07,
    1.54,
    2.02,
    2.49,
    2.96,
    3.43,
    3.9,
    4.37,
    4.86,
    5.34,
    5.81,
    6.28,
    6.75,
    7.22,
    7.69,
    8.16,
    8.64,
    9.11,
    9.58,
    10.05,
    10.52,
    10.99,
    11.46,
    11.94,
    12.41,
    12.9,
    13.37
  ],
  "sigma_v_kms": [
    3.53,
    4.83,
    2.5,
    7.58,
    4.03,
    2.74,
    2.65,
    2.88,
    3.05,
    3.68,
    3.25,
    2.99,
    1.96,
    1.53,
    1.86,
    1.48,
    0.99,
    1.19,
    1.26,
    1.33,
    1.35,
    2.09,
    2.38,
    1.08,
    3.22,
    2.37,
    0.95,
    0.96,
    0.99,
    0.74,
    1.31
  ],
  "v_baryon_disk_kms": [
    12.59,
    14.22,
    15.27,
    17.04,
    18.03,
    22.44,
    24.92,
    25.85,
    26.01,
    25.36,
    25.01,
    24.48,
    23.7,
    22.69,
    21.59,
    20.86,
    20.11,
    19.38,
    18.7,
    18.06,
    17.47,
    16.94,
    16.44,
    15.98,
    15.57,
    15.18,
    14.81,
    14.47,
    14.16,
    13.86,
    13.59
  ],
  "v_baryon_gas_kms": [
    6.82,
    8.12,
    9.3,
    10.41,
    11.27,
    15.22,
    18.74,
    21.52,
    23.28,
    24.59,
    25.62,
    26.35,
    27.08,
    27.81,
    28.4,
    28.98,
    29.57,
    30.3,
    31.18,
    32.06,
    32.64,
    33.23,
    33.38,
    33.38,
    32.79,
    32.06,
    31.18,
    30.3,
    29.42,
    28.69,
    27.81
  ],
  "v_obs_kms": [
    16.0,
    16.6,
    18.6,
    20.0,
    21.4,
    28.9,
    32.9,
    35.2,
    37.6,
    40.6,
    42.7,
    45.5,
    48.9,
    51.5,
    53.0,
    55.0,
    57.6,
    59.7,
    60.5,
    61.8,
    62.9,
    63.0,
    64.5,
    65.6,
    67.5,
    66.8,
    66.8,
    66.6,
    66.8,
    66.3,
    66.1
  ]
}
