{
  "distance_mpc": 3.36,
  "name": "CamB",
  "notes": "SPARC Rotmod ingest from CamB_rotmod.dat",
  "r_kpc": [
    0.16,
    0.41,
    0.57,
    0.73,
    0.9,
    1.06,
    1.22,
    1.47,
    1.79
  ],
  "sigma_v_kms": [
    1.5,
    1.5,
    1.5,
    1.5,
    1.5,
    1.5,
    1.5,
    1.5,
    1.5
  ],
  "v_baryon_disk_kms": [
    3.75,
    9.47,
    11.76,
    13.72,
    14.8,
    15.24,
    15.11,
    15.9,
    14.91
  ],
  "v_baryon_gas_kms": [
    1.86,
    4.24,
    5.61,
    6.77,
    7.77,
    8.44,
    8.64,
    8.08,
    6.91
  ],
  "v_obs_kms": [
    1.99,
    4.84,
    6.79,
    8.87,
    10.9,
    12.9,
    14.7,
    16.8,
    20.1
  ]
}
