{
  "distance_mpc": 4.35,
  "name": "UGCA442",
  "notes": "SPARC Rotmod ingest from UGCA442_rotmod.dat",
  "r_kpc": [
    0.42,
    1.26,
    2.11,
    2.96,
    3.79,
    4.65,
    5.48,
    6.33
  ],
  "sigma_v_kms": [
    1.91,
    1.82,
    1.74,
    1.91,
    2.05,
    3.12,
    2.83,
    0.65
  ],
  "v_baryon_disk_kms": [
    4.78,
    10.76,
    13.6,
    13.29,
    12.56,
    12.33,
    12.04,
    10.62
  ],
  "v_baryon_gas_kms": [
    4.87,
    13.14,
    19.65,
    22.42,
    22.82,
    21.37,
    18.73,
    16.75
  ],
  "v_obs_kms": [
    14.2,
    28.6,
    41.0,
    49.0,
    54.8,
    56.4,
    57.8,
    56.5
  ]
}
