{
  "distance_mpc": 4.83,
  "name": "ESO444-G084",
  "notes": "SPARC Rotmod ingest from ESO444-G084_rotmod.dat",
  "r_kpc": [
    0.26,
    0.77,
    1.29,
    1.81,
    2.32,
    3.39,
    4.44
  ],
  "sigma_v_kms": [
    1.8,
    3.0,
    4.63,
    1.26,
    3.11,
    1.35,
    7.36
  ],
  "v_baryon_disk_kms": [
    8.31,
    14.79,
    14.54,
    13.66,
    12.28,
    9.97,
    8.53
  ],
  "v_baryon_gas_kms": [
    4.59,
    11.55,
    16.45,
    19.03,
    20.09,
    17.39,
    14.45
  ],
  "v_obs_kms": [
    18.3,
    35.3,
    47.8,
    52.8,
    58.0,
    63.1,
    62.7
  ]
}
