{
  "distance_mpc": 89.1,
  "name": "F574-2",
  "notes": "SPARC Rotmod ingest from F574-2_rotmod.dat",
  "r_kpc": [
    2.17,
    4.32,
    6.49,
    8.65,
    10.83
  ],
  "sigma_v_kms": [
    10.0,
    10.0,
    8.0,
    8.0,
    8.0
  ],
  "v_baryon_disk_kms": [
    21.61,
    27.24,
    34.0,
    34.44,
    36.32
  ],
  "v_baryon_gas_kms": [
    -8.64,
    -7.74,
    15.6,
    23.65,
    28.17
  ],
  "v_obs_kms": [
    12.6,
    23.0,
    30.0,
    36.0,
    40.0
  ]
}
