{
  "distance_mpc": 54.0,
  "name": "F563-V1",
  "notes": "SPARC Rotmod ingest from F563-V1_rotmod.dat",
  "r_kpc": [
    1.31,
    2.63,
    3.93,
    5.24,
    6.55,
    7.87
  ],
  "sigma_v_kms": [
    5.0,
    5.0,
    5.0,
    5.0,
    5.0,
    5.0
  ],
  "v_baryon_disk_kms": [
    11.06,
    16.85,
    23.41,
    24.18,
    23.59,
    23.33
  ],
  "v_baryon_gas_kms": [
    4.66,
    9.66,
    13.79,
    16.46,
    18.52,
    20.17
  ],
  "v_obs_kms": [
    12.0,
    21.7,
    28.6,
    29.5,
    28.6,
    27.3
  ]
}
