{
  "name": "Milky Way",
  "distance_mpc": 0.008,
  "inclination_deg": 0.0,
  "notes": "Sofue 2020 rotation curve with analytic baryon decomposition (disk+bulge+gas).",
  "r_kpc": [0.5, 1.0, 2.0, 3.0, 4.0, 5.0, 6.0, 7.0, 8.0, 10.0, 12.0, 14.0, 16.0, 18.0, 20.0],
  "v_obs_kms": [100.0, 150.0, 190.0, 210.0, 220.0, 225.0, 228.0, 230.0, 230.0, 228.0, 227.0, 226.0, 225.0, 224.0, 223.0],
  "sigma_v_kms": [10.0, 8.0, 7.0, 6.0, 5.0, 5.0, 4.0, 4.0, 4.0, 5.0, 5.0, 6.0, 6.0, 7.0, 7.0],
  "v_baryon_disk_kms": [60.0, 120.0, 170.0, 190.0, 200.0, 205.0, 205.0, 200.0, 195.0, 120.0, 80.0, 60.0, 40.0, 30.0, 20.0],
  "v_baryon_bulge_kms": [80.0, 70.0, 40.0, 25.0, 10.0, 5.0, 2.0, 0.0, 0.0, 0.0, 0.0, 0.0, 0.0, 0.0, 0.0],
  "v_baryon_gas_kms": [10.0, 15.0, 20.0, 25.0, 30.0, 35.0, 35.0, 35.0, 35.0, 40.0, 40.0, 40.0, 40.0, 40.0, 40.0]
}
