{
  "distance_mpc": 6.8,
  "name": "KK98-251",
  "notes": "SPARC Rotmod ingest from KK98-251_rotmod.dat",
  "r_kpc": [
    0.25,
    0.41,
    0.57,
    0.74,
    0.9,
    1.07,
    1.24,
    1.4,
    1.57,
    1.72,
    1.89,
    2.06,
    2.46,
    2.79,
    3.13
  ],
  "sigma_v_kms": [
    2.0,
    2.0,
    2.0,
    2.0,
    2.0,
    2.0,
    2.0,
    2.0,
    2.0,
    2.0,
    2.0,
    2.0,
    2.0,
    2.0,
    2.0
  ],
  "v_baryon_disk_kms": [
    2.88,
    3.93,
    4.8,
    6.36,
    7.43,
    8.56,
    9.52,
    10.08,
    10.55,
    10.95,
    11.36,
    11.57,
    12.23,
    12.94,
    12.45
  ],
  "v_baryon_gas_kms": [
    1.87,
    3.32,
    4.8,
    6.44,
    8.03,
    9.79,
    11.57,
    13.11,
    14.44,
    15.54,
    16.53,
    17.3,
    18.07,
    18.07,
    17.41
  ],
  "v_obs_kms": [
    4.25,
    6.84,
    9.56,
    12.3,
    15.1,
    17.5,
    19.7,
    21.8,
    24.4,
    27.3,
    30.3,
    32.6,
    33.3,
    34.6,
    34.2
  ]
}
